{
  "nsn": "7510-01-234-5678",
  "description": "PEN, BALLPOINT",
  "longDescription": "Ballpoint pen, retractable, medium point, black ink",
  "nonprofitAffiliate": "NIB",
  "performingAgency": "Lighthouse for the Blind - St. Louis",
  "unitOfMeasure": "DZ",
  "unitPrice": 4.85,
  "approvalDate": "2005-03-15",
  "status": "active",
  "federalSupplyClass": "7510",
  "productGroupName": "Office Supplies"
}